,Month,Company/Brand,Founded,Headquarters,Sector,What it does,Founder/s,Investor/s,Amount,Stage
919,April,TagZ Foods,2019,Bangalore,Food ,TagZ Foods is a supplier of snacks and food products.,"Anish Basu Roy, Sagar Bhalotia",Venture Catalysts,500000,Pre-series A
920,April,Fuel Buddy,2017,New Delhi,Oil and Energy,FuelBuddy is the FIRST legal private company in India to have permissions in place to deliver fuel. FUELDELIVERY APP.,Aditya Singh ,Jaipuria Family Office,1000000,
921,April,M1xchange,2017,Gurugram,FinTech,M1 an online exchange for TReDS set up under the approval RBI to facilitate discounting of invoices on a PAN India basis.,Sundeep Mohindru,Amazon,10000000,
922,April,Spintly,2017,Goa,Tech Startup,Wireless cloud based access control platform,Rohin Parkar,Riso Capital,500000,
923,April,EF Polymer,2018,Rajsamand,AgriTech,Sustainable Agriculture by creating sustainable inputs solution for agriculture to save water and fertilizer with enhancing yield.,Narayan Lal Gurjar,MTG Ventures,200000,
924,April,boAt,2016,New Delhi,Electronics,boAt is a consumer electronics and lifestyle company.,"Aman Gupta, Sameer Mehta","Qualcomm Ventures, Warburg Pincus",6000000,
926,April,iBus,2010,Bangalore,Telecommuncation,iBus Networks is an in-building connectivity solutions company,"Ram Sellaratnam, Sunil Menon and Subash Vasudevan",Morgan Stanley,21000000,
927,April,Puresh Daily,2019,Ranchi,Milk startup,PUREandFRES-Milk delivers fresh milk directly from its farm to home. Fresh Milk without any trace of chemicals is packed and sealed in glass bottle.,"Manish Piyush, Ayush Kumar","Alfa Ventures, Agility Venture Partners",100000,Seed
928,April,LearnVern,2016,Ahmadabad,EdTech,LearnVern.com is a training portal where anyone can learn any course in vernacular languages for free.,"Niral Modi, Aditi Modi",,1000000,
929,April,LimeChat,2020,"Faridabad, Haryana",AI Chatbot,Limechat provides a personalised shopping experience for D2C companies on chat platforms using L3 conversational AI.,"Aniket Bajpai, Nikhil Gupta","Stellaris Venture Partners, Ramakant Sharma",7500000,Seed
930,April,Dybo,2019,Bangalore,IT ,Product Visualisation Technology for Commerce,Dhawal Jain,Spanache,100000,Seed
931,April,moEVing,2021,Gurugram,Logistics,"Delivering clean, cost-effective and efficient mobility solutions.",VIKASH MISHRA,,1000000,Seed
932,April,WeWork India,2017,Bangalore,Hospitality,"Transform buildings into beautiful, collaborative workspaces and provide infrastructure, services, events and tech",Karan Virwani,,26000000,
933,April,Solethreads,2018,Gurugram,Fashion ,SOLETHREADS is a ‘Made in India’ footwear brand that’s creating a flip flop revolution.,Vikram Iyer,"DSG Consumer Partners, Saama Capital",1000000,Series A
934,April,Beldara,2018,Mumbai,E-commerce ,"BELDARA.COM IS A GLOBAL B2B marketplace, enables businesses to sell worldwide.",Bhagwan (Pradeep) Khandekar,Hindustan Media Ventures,7400000,
935,April,CredFlow,2020,New Delhi,FinTech,CredFlow provides financial solutions to automate your cashflows.,Kunal Aggarwal,"Stellaris Venture Partners, Omidyar Network India, Flourish Ventures",2000000,Seed
936,April,Do Your Thng,2018,Gurugram,Marketing,World's first shared economy platform for digital assets.,Ankit Agarwal,"Angelbay Holdings, Faad Network",1500000,
937,April,Oye Rickshaw,2017,Gurugram,Transportation,Oye Rickshaw is an electric vehicle energy solutions company that connects people with public transportation using a booking app.,"Akash Deep, Mohit Sharma","Alteria Capital, Chiratae Ventures",3000000,
938,April,Legitquest,2017,New Delhi,LegalTech,LegitQuest is a legal-tech company that operates a legal research platform with Indian case laws.,"Himanshu Puri, Karan Kalia, Rohit Shukla","WaterBridge Ventures, Info Edge",600000,
939,April,Swiggy,2014,Bangalore,Food delivery,Swiggy is an on-demand food delivery platform that brings food from neighborhood restaurants directly to customers' doors.,"Nandan Reddy, Rahul Jaimini, Sriharsha Majety","Carmignac, Falcon Edge Capital",800000000,
941,April,PlayShifu,2016,Bangalore,EdTech,PlayShifu is an EdTech startup that offers teaching/learning tools for kids (4-12 years of age).,"Dinesh Advani, Vivek Goyal","Chiratae Ventures, Bharat Innovation Fund",17000000,Series B
942,April,Pitstop,2015,Bangalore,Automotive,Pitstop offers general repair and maintenance services for cars through its doorstep service vehicles.,"Mihir Mohan Mishra, Nirant Ramakuru, Ruchi Deepak","Acko Technology, Services, LetsVenture",3500000,Pre-series B
943,April,Lendingkart,1999,Gujarat,FinTech,Lendingkart is an online financing company dedicated to help entrepreneurs and small businesses with Working Capital Loans.,"Harshvardhan Lunia, Mukul Sachan","Bertelsmann India Investments, Fullerton Financial Holdings",15000000,Debt
944,April,CRED,2018,Bangalore,FinTech,CRED is a members-only credit card management and bill payments platform that rewards users every time they pay their credit card bills.,Kunal Shah,"Dragoneer Investment Group, Tiger Global Management",215000000,Series D
945,April,Karnival,2015,Bangalore,SaaS startup,A SAAS platform for retailers and brands to create wonderful post purchase customer journeys using smart receipts technology,Neeraj Tyagi,http://100x.vc/,2500000,Seed
946,April,PharmEasy,2015,Mumbai,HealthTech,"PharmEasy is a health tech startup offering services such as teleconsultation, medicine deliveries, and diagnostic test sample collection.","Dharmil Sheth, Dhaval Shah, Mikhil Innani","TPG Growth, Caisse de Depot et Placement du Quebec",350000000,Series E
947,April,WESS,1989,Mumbai,Renewable Energy,Waaree is India's Largest Solar Module Manufacturer & fastest growing EPC company with Presence across 68 countries.,Hitesh Doshi ,Centrum Financial Services,2000000,Seed
948,April,ShopSe,2020,Mumbai,FinTech,Make purchases online or at neighborhood store in easy EMIs through ShopSe.,"Pallav Jain, Abhishek Nimonkar, Yagnesh Desai","Chiratae Ventures, BEENEXT",5500000,
949,April,Fantasy Akhada,2020,Gurugram,Fantasy sports,Fantasy Akhada offers fantasy sports platform for cricket and football.,Amit Purohit,Harsha Bhogle,600000,
951,April,Groww ,2017,Bangalore,FinTech,Groww is an investment platform that offers a new way of investing money with stockbroking and direct mutual funds.,"Harsh Jain, Ishan Bansal, Lalit Keshre, Neeraj Singh","Tiger Global Management, Y Combinator Continuity Fund",83000000,Series D
952,April,Avanti Finance,2016,Bangalore,FinTech,Avanti Finance lends relatively large but trust-based loans without formal credit footprint.,"Ratan Tata, Nandan Nilekani",Michael & Susan Dell Foundation,26000000,Series A
954,April,OfBusiness,2015,Gurugram,FinTech,OfBusiness is a financing platform that offers smart financing to SMEs.,"Asish Mohapatra, Bhuvan Gupta, Chandranshu Sinha, Nitin Jain, Ruchi Kalra, Ruchi Kalra, Srinath Ramakkrushnan, Vasant Sridhar","Falcon Edge India, Norwest Venture Partners",110000000,
955,April,Superpro.ai,2019,Bangalore,Video communication,Enabling independent professionals to bring offline consulting online with AI,"Gaurav Tripathi, Sagar Ramteke, Vijay Goel, Vivek Kumar","SOSV, Omphalos Ventures India",3000000,Seed
956,April,ShareChat,2015,Bangalore,Social Media,ShareChat is a social networking and regional content platform.,"Ankush Sachdeva, Bhanu Pratap Singh, Farid Ahsan","Twitter Ventures, Pawan Munjal",500000000,
957,April,WiT-ACE,2020,Gurugram,Skill development,"Offer accelerated career experiences for women by Enabling, Engaging & Employing them to be in decision making roles.",Anuranjita Kumar,CitiusTech,1000000,Seed
958,April,Spinny,2015,Gurugram,Retail,Spinny is a used car buying platform enabling trustworthy and hassle-free transactions.,"Mohit Gupta, Niraj Singh, Ramanshu Mahaur","Arena Holdings, Think Investments",65000000,Series C
959,April,Alteria Capital,2018,Mumbai,FinTech,Alteria Capital is a Venture debt firm .,Vinod Murali,,1.5E+11,Debt
960,April,Safexpay,2017,Thane,FinTech,SafexPay is set up with the aim to build digital payments businesses and channel platforms encompassing payment gateways,Ravi Gupta,"T Choithrams BVI, Ardor",6000000,
961,April,PumPumPum,2018,Gurugram,Rental,Pumpumpum is a car rental company.,"Tarun Lawadia, Sameer Kalra","Kogta Financial India Limited, ICICI Bank",700000,Pre-series A
962,April,Speciale Invest,2017,Bangalore,FinTech,Speciale Invest is an early stage investor focusing on Tech-driven/Deep-tech ventures.,"Vishesh Rajaram, Arjun Rao",,10000000,
963,April,Eunimart,2016,Hyderabad,E-commerce ,Eunimart is a one stop solution for merchants to create a difference by selling globally.,"Saikat Roy, Shayak Mazumder","SucSEED Venture Partners, TMT Connekt",700000,Pre-series A
964,April,Meesho,2015,Bangalore,E-commerce ,Meesho operates as an online reselling platform that enables anyone to start a business without investment.,"Sanjeev Barnwal, Vidit Aatrey","SAIF Partners, Venture Highway",300000000,
965,April,CareerLabs,2019,Bangalore,EdTech,"Aim to help students become future-ready, setting them on a path to success that suits them best.","PN Santosh, Prasanna Alagesan, Krithika Srinivasan",Global Founders Capital,2200000,
966,April,Uable,2020,Bangalore,EdTech,Uable are on a bold mission to redefine the future for millions of teenagers around the world.,Saurabh saxena,"JAFCO Asia, Chiratae Ventures",35000000,Pre-series A
967,April,Zoko,2016,Bangalore,Tech Startup,"Zoko makes it easy for businesses to do Sales, Marketing & Customer Support on WhatsApp.","Arjun Paul, Aromal Sivadasan",Y Combinator,140000000,Seed
968,April,GetWork,2019,Gurugram,Recruitment,GetWork is a campus recruiting platform to post your jobs and hire across dozens of colleges at once.,Rahul Veerwal,Artha Venture Fund,200000,Seed
969,April,Easebuzz,2015,Pune,E-commerce ,Easebuzz is an easy to use portal which allows you to start an online business and sell your favorite products with a free online store.,Rohit Prasad,"Jitendra Gupta, Amrish Rau",4000000,Series A
970,April,Chingari,2018,Bangalore,Social Media,Chingari operates as a short video platform.,Sumit Ghosh,"FJ Labs, Brian Norgard",13000000,
971,April,DusMinute,2017,Bangalore,Retail,DusMinute aims to transform how communities live by giving them access to world-class amenities at their doorstep.,Apoorva Mishra,Indian Angel Network,1100000,Pre-series A
973,March,SkilloVilla,2020,Bangalore,EdTech,Mission to support young graduates in enhancing their learnings and transform them into big earnings.,"Ronak Agrawal, Rajat Agrawal, Deepak Kharol",Titan Capital,300000,Seed
974,March,Cancer Clinics,2014,Telugana,HealthCare,"Cancer Helpline is a source of information and support, helping with all the things that people affected by cancer want and need.","Sonali Srungaram, Sasi Sunkara",Axilor,1500000,Pre-series A
975,March,Velocity,2020,Bangalore,FinTech,Velocity provides revenue-based-financing to online businesses. It aims to build the future of banking and financial services for new age businesses in India.,"Abhiroop Medhekar, Atul Khichariya, Saurav Swaroop",Valar Ventures,1300000,Seed
976,March,Happy Jars,2016,New Delhi,Food & Beverages,"Manufacture and retail a delicious range of all-natural nut butters, made without oil, sugar or preservatives.","Surabhi Talwar, Vikram Sekhar",Inflection Point Ventures,400000,Seed
977,March,Inshorts,2013,Noida,Media,Inshorts is a news aggregator application that collects and summarizes news based on user behavior and preferences.,"Anunay Pandey, Azhar Iqubal, Deepit Purkayastha","Addition, SIG Global India Fund",40000000,
978,March,ExtraaEdge,2015,Pune,MarTech,Data Science powered - Admission & Marketing CRM Automation for Education Enrolments,"Abhishek Ballabh, Sushil Mundada","9Unicorns Accelerator Fund, Indian Angel Network",1000000,Pre-series A
979,March,Zotalabs,2019,Pune,Tech Startup,Zotalabs gives the power of Emerging Technology to your digital automation with our easy to use APIs.,"Nausherwan Shah, Wasim Khan",Alfa Ventures,1250000,Seed
980,March,Voiro,2014,Bangalore,Advertisement,Voiro is the first all-in-one revenue management suite exclusively for ad-led digital publishers across media.,"Anand Gopal, Kavita Shenoy",1Crowd,1800000,Pre-series A
981,March,Dream Sports,2008,Mumbai,Gaming,"Dream Sports is India’s leading sports technology company with brands such as Dream11, FanCode, DreamX and DreamSetGo in its portfolio.","Bhavit Sheth, Harsh Jain","TCV, D1 Capital Partners, Falcon Edge.",400000000,
982,March,Safex Chemicals,1991,New Delhi,AgriTech,Safex Chemicals India Ltd is a leading company having a strong foothold in the Indian agrochemicals industry.,"SK Jindal, SK Chaudhary",BanyanTree Finance Pvt. Ltd.,50000000,
984,March,Rupifi,2019,Bangalore,FinTech,Rupifi operates a software-as-a-service (SaaS) firm focussed on financial products.,Anubhav Jain,Quona Capital,4100000,Pre-series A
985,March,Moneyboxx,1994,Mumbai,FinTech,Moneyboxx Finance provides easy access to financing to the deserving micro enterprises.,Deepak Aggarwal,"Ashv Finance, BlackSoil Capital",3000000,Debt
986,March,CityMall,2019,Gurugram,E-commerce ,CityMall is a social e-commerce platform that sells lifestyle and curated products via peer-to-peer referrals on WhatsApp.,"Angad Kikla, Divij Goyal","WaterBridge Ventures, SAIF Partners",11000000,Series A
987,March,Janani ,2020,Bangalore,Heathcare,Janani.ai is a fertility care provider.,Nilay Mehrotra,"Sweta Rau, 9Unicorns Accelerator Fund",1000000,Seed
988,March,ReshaMandi,2020,Bangalore,AgriTech,India's 1st award winning technology led digital ecosystem for Silk,Utkarsh Apoorva,"Omnivore, Strive Ventures",1700000,Seed
989,March,Bombay Shaving Company,2015,New Delhi,Lifestyle,"Bombay Shaving Company is a consumer goods company that focuses on developing a range of shave care, beard care, and skincare products.","Deepu Panicker, Raunak Munot, Rohit Jaiswal, Shantanu Deshpande","Rajesh Sud, KULDEEP JAIN",2000000,
990,March,DotPe ,2019,Gurugram,FinTech,DotPe is a technology start-up providing a commerce and payments platform to offline enterprise businesses.,"Anurag Gupta, Gyanesh Sharma, Shailaz Nag","PayU, Google",27000000,Series A
993,March,Five Star Finance,1984,Chennai,FinTech,Five-Star is a Registered Non Banking Finance Company (NBFC) with Reserve Bank of India (RBI).,V K Ranganathan,"TPG Capital Asia, Epiq Capital",234000000,
995,March,BYJU'S,2011,Bangalore,EdTech,BYJU'S is an educational technology company that develops personalized learning programs for K-12 students.,"Byju Raveendran, Divya Gokulnath","BlackRock, Owl Ventures",460000000,Series F
996,March,Annapurna Finance,2009,Bhubaneswar,FinTech,Annapurna Microfinance is a microfinance venture that works for the financial and economic upliftment of underserved and unreached women.,Gobinda Chandra Pattnaik,"Asian Development Bank, Oman India Joint Investment Fund",30000000,
997,March,HealthPlix,2014,Bangalore,HealthCare,HealthPlix is a healthtech startup,"Raghuraj Sunder Raju, Sandeep Gudibanda","JSW Ventures, Kalaari Capital",13500000,Series B
998,March,Masai School,2019,Bangalore,EdTech,Masai School is a job-oriented software training services.,Prateek Shukla,"Unitus Ventures, Omidyar Network India",5000000,Series A
999,March,Bewakoof,2011,Mumbai,D2C Fashion,"Society perceives Bewakoof as stupid.But what does society call Bewakoof?Often, it’s anything different or anything that’s done differently.",Prabhkiran Singh,"IvyCap Ventures, Pratithi Investment Trust",4000000,
1000,March,IndiaLends,2014,New Delhi,FinTech,IndiaLends is a digital lending and borrowing marketplace.,"Gaurav Chopra, Mayank Kachhwaha","ACPI Investments, AdvantEdge Founders",5100000,
1001,March,Stelis Biopharma,2007,Bangalore,BioTechnology,Stelis Biopharma is a vertically integrated biopharmaceutical company.,Pudhucode Radhakrishnan Kannan,"RouteOne, Mankekar Family Office",195000000,Series B
1002,March,Tilt ,2016,Bangalore,Bike Rental,A bike-share for Indian campuses,Deepak VS,Y Combinator,125000,
1003,March,NeoDove,2020,Jaipur,AI startup,"Neodove is an AI-powered, end to end tech-enabled customer communication and reporting solution.",Aprit Khandelwal,India Quotient,15000000,Seed
1004,March,Zaara Biotech,2016,Kottayam,BioTechnology,India's First Algal-seaweed Biotechnology Students' Startup in collaboration with ICAR- Central Institute of fisheries and Technology,Najeeb Bin Haneef,TCN International Commerce,10000000,
1005,March,KreditBee,2018,Bangalore,FinTech,KreditBee is a digital lending platform developed to assist young professionals with their personal finances.,"Karthikeyan Krishnaswamy, Madhusudan Ekambaram, Wan Hong","Alpine Capital, PremjiInvest",75000000,Seed
1006,March,True Balance,2014,Gurugram,FinTech,True Balance is a digital wallet that enables users to access utility bill payment and other financial products.,"Cheolwon Lee, Jay Yi, Martin Lee","Bon Angels Venture Partners, Daesung Private Equity",10000000,Debt
1007,March,Muvin,2020,Bangalore,FinTech,Youth Neobank enabling financial solutions for the teenagers and young people,Mukund V Rao,,1000000,Seed
1008,March,Purplle,2011,Mumbai,Beauty products,"Purplle is an online store selling cosmetics, fragrances, skin, and hair care products.","Manish Taneja, Rahul Dash","Spring Marketing Capital, Verlinvest",45000000,
1009,March,FloBiz,2019,Bangalore,Tech Startup,India’s first neobusiness platform,Rahul Raj,Elevation Capital,10000000,Series A
1010,March,Jeevam Health,2020,New Delhi,Health care,Jeevam Health is an Online Medical Clinic to Cure Root Cause of Chronic Issues in India.,"Kamran alam, Piyush vishwakarma",Y Combinator,1500000,Pre-seed
1011,March,NewLink Group,2016,Beijing,Tech Startup,Developer of an energy management and transportation digital platform designed to streamline the energy supply chain,"Yang Wang, Zhen Dai",Bain Capital,200000000,
1012,March,OZiva,2016,Mumbai,Heathcare,OZiva is a plant-based Clean Nutrition Brand.,"Aarti, Mihir Gadani","F-Prime Capital, Eight Roads Ventures India",12000000,Series B
1013,March,Blive,2004,Panaji,Tourism,B: Live is an electric vehicle tourism startup.,"Samarth Kholkar, Sandeep Mukherjee","Mumbai Angels, DNA Entertainment Networks",1000000,Pre-series A
1014,March,Nazara Technologies,2000,Mumbai,Gaming,"Nazara Technologies develops mobile content such as games, themes, wallpapers, and multimedia.",Nitish Mittersain,"Hornbill Capital Advisers, Plutus Wealth Management",30000000,
1015,March,Euler Motors,2018,New Delhi,Automotive,Electric Light Commercial Vehicle,Saurav Kumar,"ADB Ventures, Jetty Ventures",2600000,Series A
1016,March,Pixxel,2019,Bangalore,SpaceTech,Pixxel is a Bengaluru-based space technology startup building a constellation of advanced earth imaging small satellites.,"Awais Ahmed, Kshitij Khandelwal","Techstars, Ryan Johnson",7300000,Seed
1017,March,Prescinto,2016,Gujarat,Solar ,Prescinto is the brain of a solar plant delivering Actionable Intelligence to Increase Generation.,Puneet Jaggi,"Venture Catalysts, 9Unicorns Accelerator Fund",3500000,Seed
1018,March,MyGlamm,2015,Mumbai,Beauty products,MyGlamm is a direct-to-consumer brand of award winning European beauty products.,Darpan Sanghvi,Bessemer Venture Partners,20000000,Series C
1019,March,Chirrup,2020,Bangalore,Gaming,Video integrated social-gaming platform,"Vipul Garg, Sourav Lashkari, Mehul Mittal","Titan Capital, iSeed, First Cheque, 3.0 Fund.",300000,Pre-seed
1020,March,Policybazaar,2008,Gurugram,Insurance,PolicyBazaar designs an online life insurance and general insurance comparison portal that analyzes financial products.,"Alok Bansal, Avaneesh Nirjar, Manoj Sharma, Tarun Mathur, Yashish Dahiya","Falcon Edge Capital, White Oak Global Advisors",75000000,
1021,March,Livve Homes,2017,Bangalore,Rental space,"India's homegrown online portal, championing the region for a brighter, more exciting livvable future. Right from simply connecting owners and tenants and to managing everything in between",Maya Lakshman,Angel investors,5000000,
1022,March,Juicy Chemistry,2014,Coimbatore,Healthcare,Juicy Chemistry operates as an eponymous consumer brand.,"Megha, Pritesh Asher.",Akya Ventures,6300000,Series A
1023,March,Svasti Microfinance,2008,Mumbai,FinTech,Svasti works with urban slum dwellers women microentrepreneurs.,"Arunkumar Padmanabhan, Narayanan Subramaniam","Kayenne Ventures, Nordic Microfinance Initiative",4000000,
1024,March,Nexprt,2020,New Delhi,Consulting,Nexprt Solutions offers end-to-end and 100% customized import solutions.,Harsha Vardhan K,Titan Capital,2000000,
1026,March,Ankur capital,2011,Mumbai,FinTech,Early stage venture capital fund focused on opportunities created by rising aspirations & digital access for next billion Indians.,Ritu Verma,,40000000,
1027,March,Indifi,2015,Gurugram,FinTech,Indifi Technologies is a digital lending platform that offers loans to those that have potential and intent.,"Alok Mittal, Siddharth Mahanot, Sundeep Sahi","Elevar Equity, Accel India",5000000,Debt
1029,March,Say Cheese,2020,Mumbai,FemTech ,"Say Cheese is the first holistic women-happiness platform in India, focused to increase the happiness of women through personalized solutions",Rajpreet Kaur,,1000000,Seed
1030,March,Indic Inspirations,2019,Pune,Cultural,"Indian Souvenirs online that reflect Indian tradition, culture & stories. Best for personal gifting and corporate gifting.",Sunil Jalihal,Marquee investors,300000,
1031,March,Bimaplan,2020,Mumbai,FinTech,Affordable insurance for the next billion Indians,Vikul Goyal,"Titan Capital, Y Combinator",500000,Seed
1032,March,YAP,2014,Chennai,FinTech,YAP is the API Platform for Banking and Payments products in Asia. More than 200 Fintechs across Asia rely on YAP,"Madhusudanan R, Prabhu R","Jitendra Gupta, Better Capital",10000000,Series B
1033,March,Leap Finance,2019,Bangalore,FinTech,Leap Finance is a fintech startup for Indian students pursuing international higher education,Vaibhav Singh,Jungle Ventures,17000000,Series B
1034,March,BlackSoil NBFC,2010,Mumbai,FinTech,BlackSoil Capital has transformed into an alternative NBFC and AIF Fund platform with an expertise to finance multiple sectors.,Mohinder Pal Bansal,,3000000,
1035,March,OYO,2012,Gurugram,Hospitality,OYO operates a branded network of hotels designed to offer standardized stay experiences.,Ritesh Agarwal,Hindustan Media Venture,200000000,
1036,March,Max Healthcare,2000,New Delhi,Healthcare,Max Healthcare is one of the leading chain of hospitals in India.,Analjit Singh,"Radiant Life Care Private Ltd, Life Healthcare",140000000,
1037,March,4baseCare,2018,Bangalore,HealthTech,4baseCare develops a unified and patient-centric ecosystem to fight cancer.,"Hitesh Goswami, Kshitij Rishi","Mount Judi Ventures, growX Ventures, Season Two Ventures",2000000,Pre-series A
1038,March,Ezstays,2019,New Delhi,EdTech,"Ezstays is a leading student-life network, providing hostels and PG accommodation with top-tier living facilities at the best prices.","Vaibhav Khanna, Abhishek Kumar, Kumar Gaurav",Richard Rekhy,400000,Seed
1039,March,Stylework,2017,Gurugram,Co-working,Stylework is an unconventional co-working space aggregator that is going to change the way people work.,Sparsh Khandelwal,Inflection Point Ventures,500000,Pre-series A
1040,March,Kinara Capital,2011,Bangalore,FinTech,Kinara Capital is a financing company that provides flexible collateral-free loans to small business entrepreneurs.,Hardika Shah,"GAWA Capital, Gaja Capital",6000000,
1041,March,Riskcovry,2018,Bangalore,InsureTech,"Riskcovry is an ""Insurance-in-a-box” model offers a one-stop-shop platform to cater to any business's digital insurance needs.","Suvendu Prusty, Sorabh Bhandari, Vidya Sridharan, Chiranth Patil","Better Capital, Bharat Inclusion Seed Fund",5000000,Series A
1042,March,NODWIN,2012,Gurugram,Gaming,NODWIN Gaming is a gaming solutions company and creator of e-sports events.,Gautam Virk,Krafton,20000000,
1043,March,Quizizz,2015,Bangalore,EdTech,Quizizz is a Education based startup,"Ankit Gupta, Deepak Joy Cheenath","Eight Roads Ventures India, Nexus Venture Partners",12500000,Series A
1044,March,Ecom Express,2012,New Delhi,E-commerce ,Ecom Express is an end-to-end technology-enabled logistics solutions provider to the Indian e-commerce industry.,"K. Satyanarayana, Manju Dhawan, Sanjeev Saxena, T. A. Krishnan","CDC Group, Partners Group",20000000,
1045,March,Turtlemint,2015,Mumbai,InsureTech,Turtlemint is an online insurance platform that identifies and purchases appropriate insurance policies for consumers.,"Anand Prabhudesai, Dhirendra Mahyavanshi, Kunal Shah",Jungle Ventures,45000000,Series D
1046,March,Captain Fresh,2019,Bangalore,Supply chain platform,Captain Fresh is a freshwater fish and seafood supply chain platform.,Utham Gowda,"Matrix Partners India, Ankur Capital",3000000,Seed
1047,March,Northern Arc,2008,Chennai,FinTech,Northern Arc Capital (Formerly known as IFMR Capital) is a Non-Banking Finance Company.,Kshama Fernandes,"U.S. International Development Finance Corp, Asian Development Bank",10000000,Debt
1048,March,Qoohoo,2020,Bangalore,Social platform,A platform for creators to build immersive connections with their fans and followers and monetize them.,"Vimal Singh Rathore, Aseem Gupta",Angel investors,800000,Seed
1049,March,IGL,2016,Mumbai,Gaming,Indian Gaming League is the premier eSports platform in India.,Yash Pariani,"Hungama, Hindustan Talkies",500000,
1050,March,AMPM,2018,Gurugram,E-commerce ,24*7 convenience store,Shubham Gupta,Agility Venture Partners,200000,
1051,March,The ePlane,2016,Chennai,Drone,"Transforming the mobility landscape using aerial transport. Currently, we build drones for industrial applications","Pranjal Mehta, Satyanarayanan Chakravarthy","Speciale Invest, Farid Ahsan",1000000,Seed
