,Month,Company/Brand,Founded,Headquarters,Sector,What it does,Founder/s,Investor/s,Amount,Stage
492,August,Probus,2017,New Delhi,IoT,"A mission to increase the per capita consumption of electricity in India by 10X, which is presently 1/3 of global average- by reducing the distribution losses in Indian electricity distribution grid.","Anand Singh, Ankit Vaish, Sunny Kumar Jadoon",Unicorn India Ventures,500000,Bridge
493,August,DrinkPrime,2016,Bangalore,Consumer Goods,India's Smartest Water Purifiers and are redefining water purifier ownership.,Anil Kejriwal,"UC Inclusive Credit, Western Capital",1000000,
494,August,Smart Express,,Mumbai,Logistics,India’s Most Innovative and Awarded Express Logistics Company.,Yogesh Dhingra,"IIFL India Private Equity Fund, Smiti Holding & Trading Company",10000000,Seed
495,August,Smallcase,2015,Bangalore,FinTech,Smallcase is a new way to invest in the stock markets.,"Anugrah Shrivastava, Vasanth Kamath, Rohan Gupta",Faering Capital,40000000,Series C
496,August,SATYA MicroCapital,2017,New Delhi,Banking,Satya MicroCapital Limited is a Delhi based NBFC serving low income entrepreneurs in rural and urban areas.,Vivek Tiwari,"responsAbility Investments, Blue Orchard",10000000,
498,August,Postman,2014,Bangalore,Computer software,Postman is the collaboration platform for API development.,"Abhinav Asthana, Abhijit Kane, Ankit Sobti","CRV, Nexus Venture Partners",225000000,Series D
499,August,Hashnode,2016,Bangalore,Computer software,The easiest way to start a blog on personal domain for free & connect with the readers through our dev community,"Syed Fazle Rahman, Sandeep Panda","Salesforce Ventures, Sierra Ventures, Sequoia Capital India’s Surge",6700000,Series A
500,August,RACEnergy,2018,Hyderabad,Automotive,RACEnergy is working to power the future of mobility through clean and efficient technologies.,Arun Sreyas Reddy,"Micelio Fund, growX ventures",1300000,Seed+
501,August,BharatPe,2018,New Delhi,FinTech,The vision to make financial inclusion a reality for Indian merchants.,"Ashneer Grover, Shashvat Nakrani","IIFL Wealth, Asset Management, Northern Arc Capital",20000000,Debt
502,August,Gyde,2019,Pune,Computer software,"Gyde is a SAAS product that enables enterprises & SAAS companies to guide their application (web & mobile) users with step-by-step voice assistance, byte-sized training videos & rich help articles.","Prasanna Vaidya, Shubham Deshmukh","Better Capital, Ashish Achrekar",250000,Seed
504,August,AgNext,2016,Chandigarh,AgriTech,"AgNext is a fast-growing AgTech company that aims to solve quality and trust in food value chains by making them safer, transparent and fairer.",Taranjeet Singh Bhamra,Alpha Wave Incubation,21000000,Series A
505,August,Xpresslane,2019,Bangalore,Tech startup,"Xpresslane makes checkout fast and easy. With a unified identity across all e-commerce merchants, it brings efficiency and perfection in the overall checkout experience of the user.",Ashwin Koorakula,"Point One Capital, Yatra Angel Network (YAN), Opus Consulting, Manipal Technologies.",400000,Pre-seed
506,August,LoanKuber,2016,New Delhi,Digital mortgage,LoanKuber is the lowest cost lender to Yest-to be Bankable - enabling borrowing with trust and confidence.,Saurabh Nagpal,,1200000,Pre-Series A
507,August,OYO,2013,Gurugram,Hospitality,OYO is a global travel tech company that connects its patrons and guests.,Ritesh Agarwal,Microsoft,5000000,Series F2
508,August,Rapido,2015,Bangalore,Information Technology & Services,Rapido is a bike taxi service spread widely across all of India from Tier 1 to Tier 3 cities.,"Aravind Sanka, Pavan Guntupalli, SR Rishikesh","Shell Ventures, Yamaha, Kunal Shah",52000000,
509,August,YPay,2017,Noida,Fintech,YPay Card is the new way to manage money.,Dr Navneet Gupta,We Founder Circle,400000,
510,August,SleepyCat,2017,Mumbai,Furniture,An online sleep solutions company that believes in delivering luxurious sleep to everyone.,Kabir Siddiq,"Saama Capital, DSG Consumer Partners, Sharrp Ventures",3800000,
511,August,Ultrahuman,2020,Bangalore,Healthcare,Ultrahuman is a global health and fitness platform that aids our user to achieve their true physical and mental potential.,"Mohit Kumar, Vatsal Singhal",Tiger Global’s Scott Schleifer,17500000,
512,August,UpScalio,2021,Gurugram,E-commerce,"UpScalio is India’s next generation, data-driven consumer goods company.",Gautam Kshatriya,,42000000,
513,August,Yellow Class,2020,Gurugram,EdTech,"Yellow Class is a new-age fun-learning platform where kids between 2-12 years can learn from a wide range of classes like dancing, drawing, personality development, creative writing and so on","Anshul Gupta, Arpit Mittal",Elevation Capital,6000000,
514,August,Yojak,2019,Gurugram,B2B marketplace,India’s first B2B online marketplace for building material.,Anuj Jain,Info Edge Ventures,3800000,
515,August,CreatorStack,2019,Bangalore,Computer software,Helping creators globally to engage deeply with their fans and communities,"Ankit Acharya, Kevin William David",Accel,2000000,
516,August,Expertrons,2019,Mumbai,EdTech,The world's largest AI Videobot platform providing futuristic solutions for businesses & colleges and employment,"Jatin Solank, Vivek Gupta","Venture Catalysts, Auxano Capital, Venture Garage, Yoga Capital, Ah!Ventures, Lead Angels",2300000,
517,August,Rage Coffee,2018,New Delhi,Food & Beverages,"Rage Coffee is a digitally native FMCG company that manufactures, markets & distributes innovative coffee products.",Bharat Sethi,Sixth Sense Ventures,5000000,
518,August,Klub,2019,Bangalore,Financial Services,Klub was founded with the vision of revolutionizing growth capital for Asia’s most loved brands.a,"Anurakt Jain, Ishita Verma","9Unicorns, Sequoia Capital India’s Surge",20000000,
519,August,Navia Life Care,2016,New Delhi,Healtcare,Navia Life Care is a health technlogy company with a special focus on patient care.,"Nupur Khandelwal, Kunal Kishore Dhawan, Gaurav Gupta","Anicut Angel Fund, 9 Unicorns",1000000,
520,August,1K Kirana Bazaar,2018,Gurugram,Retail,India's First and Largest Network of Small-Town Kirana Stores,"Abhishek Halder, Anilesh Yadav, Kumar Sangeetesh","Info Edge, FalconEdge",7000000,
521,August,Zupee,2018,Gurugram,Gaming,"Mission to improve people’s lives by improving their learning ability, skills and mental aptitude through scientifically designed mental exercises, applications","Dilsher Singh, Siddhant Saurabh","WestCap Group, Tomales Bay Capital",30000000,
522,August,Locale.ai,2019,Bangalore,Location Analytics,Location Analytics for Companies With Moving Assets and Ground Operations.,"Rishabh Jain, Aditi Sinha","Chiratae Ventures, Better Capital",1000000,
523,August,VerSe Innovation,2018,Bangalore,Media,"The core of the company (VerSe Innovation), is the idea that technology can help bridge the digital divide.",Umang Bedi,"Siguler Guff, Baillie Gifford",450000000,
525,August,Miko,2015,Mumbai,Consumer Electronics,"Miko is an advanced robotics startup founded by three IIT Bombay post-graduates on the pillars of robotics, AI & IoT.","Sneh R Vaswani, Prashant V Iyengar, Chintan S Raikar","IIFL AMC, Mankind Pharma Family Office, Aroa Ventures",28000000,
526,August,Whiz League,2020,New Delhi,EdTech,Revolutionizing learning experience that goes beyond academia,"Natasha Jain, Sonia Agarwal Bajaj",ITI Growth Opportunities,300000,
527,August,Hash,2020,New Delhi,Tobacco,Hash is a new startup in consumer goods.,Shwetank Jain,Amrac Investment Trust,3500000,
529,August,Log 9 Materials,2014,Bangalore,Deeptech,Log9 Materials is on a mission to make global energy 100% clean.,"Akshay Singhal, Kartik Hajela",Amara Raja Batteries,8500000,Series A+
530,August,upGrad,2015,Mumbai,EdTech,"upGrad is India’s largest online higher education company providing programs in Data Science, Technology, Management and Law, to students, working professionals and enterprises.","Phalgun Kompalli, Ronnie Screwvala, Mayank Kumar",India Infoline Finance,25000000,
531,August,FlashPrep,2020,Bangalore,EdTech,FlashPrep is the smart way to master learning.,"Dhiresh Nagwani, Ashwini Dhekane",Venture Highway,500000,Pre-seed
532,August,Kenko Health,2019,Mumbai,Insuretech,"A unique healthcare financing solution focusing on ROI, affordability and superior customer experience","Aniruddha Sen, Dhiraj Goel","BEENEXT, Orios",1700000,Pre-series A
533,August,Wiz Freight,2020,Chennai,Logistics & Supply Chain,"Wiz is a tech-enabled freight forwarding platform. We make global shipping efficient, hassle-free and highly visible for businesses.","Ramkumar Govindarajan, Ramkumar Ramachandran",Axilor,3500000,Seed
534,August,Credgenics,2018,New Delhi,Financial Services,Credgenics is India’s first of it's kind NPA resolution platform backed by credible investors including Accel Partners and Titan Capital.,"Rishabh Goel, Mayank Khera, Anand Agrawal","Westbridge Capital, Tanglin Venture Partners",25000000,Series A
535,August,BlueLearn,2020,Goa,EdTech,"Building India's largest student community. Learn, network, and grow together with 40,000+ students!","Harish Uthayakumar, Shreyans Sancheti","100X.VC﻿,﻿ Titan Capital, Rahul Mathur, Gaurav Mandlecha",400000,Pre-seed
536,August,NimbleBox.ai,2018,Chennai,MLOps platform,A full-stack MLOps platform built to create & launch multi-cloud apps on the cloud,"Anshuman Pandey, Rohan Pooniwala",Venture Catalysts,1000000,Seed
537,August,Pickrr,2015,Gurugram,Logistics & Supply Chain,India's 1st Virtual Logistics solution catering to Global Brands/SMEs/Online sellers/AmazonSellers,"Rhitiman Majumdar, Gaurav Mangla, Ankit Kaushik","IIFL, Amicus Capital, Ananta Capital",12000000,Series B
538,August,Stellaris Venture Partners,2015,Bangalore,Venture Capital,Early-stage tech VC in India.,"Ritesh Banglani, Alok Goyal, Rahul Chowdhri",,225000000,
539,August,Grip Invest,2020,Gurugram,Financial Services,"Grip offers investment opportunities to invest in physical assets leased to corporates, to earn fixed monthly returns.","Nikhil Aggarwal, Vivek Gulati","Venture Highway, Endiya Partners",3000000,Series A
540,August,Heads Up For Tails,2008,New Delhi,Pet care,"A one stop shop for all pet products with paw prints all across India, we design, manufacture and customize stylish",Rashi Sanon,"Verlinvest, Sequoia Capital India",37000000,Series A
541,August,Blue Tokai Coffee Roasters,2012,New Delhi,Food & Beverages,"Source, roast, and brew India's best single-origin Arabica coffee.","Matt Chitharanjan, Shivam Shahi, Namrata Asthana",Anicut Angel Fund,2000000,Pre-series B
542,August,Neeman,2017,Hyderabad,Consumer Goods,India's first Startup to use the world's most revolutionary Natural & Renewable fibers in Footwear,Taran Chhabra,Sixth Sense Ventures,2000000,Series A
543,August,BharatPe,2018,New Delhi,FinTech,"BharatPe launched India’s first UPI interoperable QR code, first ZERO MDR payment acceptance service, and first UPI payment backed merchant cash advance service.","Ashneer Grover, Shashvat Nakrani",Tiger Global,370000000,Series E
544,August,GoSats,2020,Bangalore,FinTech,GoSats is a bitcoin stacking app that lets users earn bitcoin cashbacks when they shop with our partnered merchants.,"Mohammed Roshan, Roshni Aslam","Alphabit Fund, Fulgur Ventures, Stacks Accelerator, SBX Capital",700000,Seed
545,August,StockGro,2020,Bangalore,FinTech,Making Investment Social- India's First Social Trading Platform,Ajay Lakhotia,"Roots Ventures, Velo Partners",5000000,Pre-series A
546,August,Onsurity,2020,Bangalore,Healthcare,"Onsurity is a HealthTech & Employee Benefits organization, disrupting the SME and startup healthcare market with technology and innovation!","Yogesh Agarwal, Kulin Shah",Nexus Venture Partners,16000000,Series A
547,August,Khabri,2017,Gurugram,Media,Khabri is India’s fastest growing vernacular audio platform targeted at next billion internet users.,"Pulkit Sharma, Aankit Roy, Sandeep Singh",,2000000,Pre-series A
548,August,Celcius,2020,Mumbai,Logistics,Celcius is a asset light startup with a web and app based SaaS platform which brings the complete cold chain solution network ONLINE,Swarup Bose,"Mumbai Angels Network, Huddle, Lumis Partners",500000,
551,August,Rocket Skills,2020,Gurugram,EdTech,Rocket Skills is the #1 Platform for learning skills which will bring a high positive impact on your business and life skills.,"Vibhu Bahuguna, Mohit Jain","Better Capital, First Cheque, Titan Capital",200000,Pre-seed
552,August,RenewBuy,2015,Gurugram,FinTech,"Simplify insurance and aim to take it to the last Indian, through our digitally enabled POSP advisors.",Balachander Sekhar,Evolvence Capital,10000000,Series C
553,August,Faarms,2020,Bangalore,AgriTech,FAARMS™ is a new age digital platform which aims to offer a one-stop solution to farmers.,"Taranbir Singh, Alok Duggal",,2000000,Seed
554,August,UrbanMatrix Technologies,2019,Chennai,Drone,Helping Industries & Organizations to seamlessly adopt drones in their workflow to elevate efficiency & profitability,"Rishabh Verma, Ashutosh Kumar, Divyanshu Pundir",SARA ELGI,100000,
555,August,Jupiter,2019,Mumbai,Banking,"A digital banking experience that keeps pace with you, and helps master money too.",Jitendra Gupta,"Nubank, Global Founders Capital, Sequoia Capital India, Matrix Partners India",44000000,Series B
556,August,Pixuate,2012,Bangalore,DeepTech,"Pixuate enables intelligent business process automation through advanced computer vision, AI and machine learning.","Akshata Kari, Prathvi Palekar",SucSEED Indovation Fund,1000000,Seed
557,August,Playo,2014,Bangalore,SportsTech,Playo is a one stop destination app for all things sports,Daanish Suhail,ah! Ventures High Tables,500000,Pre-series A
558,August,Toothsi,2018,Mumbai,Health,India’s first and largest at home smile makeover service using invisible aligners.,"Dr Arpi Mehta, Dr Pravin Shetty, Dr Manjul Jain, Dr Anirudh Kale","Eight Roads Ventures, Think Investments, Mankekar Family Office",20000000,Series B
559,August,Soothe Healthcare,2012,New Delhi,Consumer Goods,"Soothe is a consumer goods company engaged in manufacture, marketing & distribution of Personal Hygiene products.",Sahil Dharia,A91 Partners,10000000,Series C
560,August,Goodmeetings,2020,Bangalore,Computer software,AI-Based Platform Built Exclusively for Remote Selling,Srinivasan Narayan,Chiratae Ventures,1700000,Series A
561,August,Apnaklub,2020,Bangalore,Wholesale,Apnaklub is India's most trusted wholesale platform that empowers people to set up their own retail and sales businesses by providing better-than-industry margins,"Shruti, Manish Kumar",Sequoia’s Surge,3500000,Seed
562,August,ChefKart,2020,Gurugram,Consumer Goods,"ChefKart is an end to end kitchen aide that plans, shops and cooks for you in your home kitchen.","Vaibhav Gupta, Arpit Gupta, Aman Gupta","Lead Angels, Titan Capital, Pravega Ventures",300000,Pre-seed
563,August,Fashinza,2020,Gurugram,Apparel & Fashion,A new-age supply chain and product development platform for the fashion industry.,"Pawan Gupta, Abhishek Sharma","Accel Partners, Elevation Capital",20000000,Series A
565,August,QuickShift,2016,Pune,Logistics & Supply Chain,"Helping D2C brands scale with our AI powered Dashboard that manages Inventory, Order Processing, WMS, Shipping, Customer Support",Anshul Goenka,"Anicut Angel Fund, Axilor Ventures",770000,Seed
566,August,StackBOX,2016,Bangalore,Logistics & Supply Chain,DISTRIBUTION SIMPLIFIED,"Shanmukha Boora, Sabyasachi Bhattacharjee","Ecosystem Ventures, CMM group",1200000,
568,August,infra.market,2016,Thane,Construction,Infra.Market is a Construction Solutions company that leverages technology to provide an enhanced procurement experience for all players in the construction ecosystem.,"Souvik Sengupta, Aaditya Sharda",Tiger Global,125000000,Series D
569,July,SP Robotic Works,2012,Chennai,EdTech,An innovative place to explore next-generation technologies for students and all tech enthusiasts.,"Sneha Priya, Pranavan S",Mount Judi India Growth Fund,3000000,Series A
570,July,3SC,2018,Gurugram,Logistics,An end-to-end supply chain analytics company that provides execution and analytics solutions which are comprehensive and customized.,"Lalit, Sarita Das",GEF Capital’s South Asia Fund,15000000,Series B
571,July,Chai Waale,2018,Chennai,Food & Beverages,"A wide range of exotic flavoured chai, in the most hygienic ambience at pocket-friendly prices.",Vidur Maheswari,"Sunil Sethia, Sunil Kumar Singhvi, Manish Mardia",600000,
572,July,Minimalist,2020,Jaipur,Cosmetics,Affordable skincare for all,"Mohit, Rahul Yadav",Sequoia Capital,10000000,Series A
573,July,Biconomy,2019,New Delhi,Blockchain,Developer platform to enable a simplified transaction and onboarding experience for Web3 projects,"Aniket Jindal, Sachin Tomar","Mechanism Capital, DACM",9000000,
574,July,Fixcraft,2018,Gurugram,Automotive,India's Most Trusted Automotive Repair Brand,"Vivek Sharma, Abhishek Goyal, Inderjeet Rao",,1000000,Pre-series A
575,July,Slice,2016,Bangalore,Financial Services,"Slice is India's best credit card challenger to pay bills, manage expenses, and unlock rewards",Rajan Bajaj,"Northern Arc Capital, Niyogin Fintech Limited, Credit Saison India, Vivriti Capital",10000000,
576,July,90+ My Tuition App,2015,Bangalore,EdTech,Daskalos Virtual Academy Pvt Ltd is a company set up by a group of professionals who perform innovative work in management.,Vingish Vijay,Pearl Investment LLC,5000000,Series A
577,July,Wasabi,2021,Bangalore,Consulting,Help small businesses grow their sales via our customer interaction and growth platform.,"Pradeep Dodle, Nikhil Goenka","021 Capital, Sparrow Capital",1800000,Seed
578,July,Strata,2019,Bangalore,Real Estate,Strata is an innovative tech-driven platform redefining Fractional Investments in Premium Commercial Real Estate,"Sudarshan Lodha, Priyanka Rathore","Kotak Investment Advisors Limited, Gruhas Proptech",6000000,Series A
579,July,Ourbetterplanet,2020,Bangalore,E-commerce,A curated online marketplace for all things sustainable!,Pallavi Srivastava,VANS Group,300000,Seed
580,July,Murf.ai,2020,Bangalore,SaaS startup,"Murf AI is working on simplifying voice audio and making high-quality voice overs accessible to everyone, using artificial intelligence.","Sneha Roy, Ankur Edkie, Divyanshu Pandey",Elevation Capital,1500000,Seed
581,July,JetSynthesys,2014,Pune,Media,"JetSynthesys is the group's most innovative company in the promising Digital and Technology Business World with a vision to create world class digital products, platforms and services in India",Rajan navani,Sachin Tendulkar,2000000,
582,July,MYFITNESS,2019,Silvassa,Fitness,"A new age D2C health & fitness brand with a mission to deliver products that taste good, feel good and do good.","Mohammad Patel, Rahil Virani",9Unicorns,1000000,Seed
583,July,I am Love,2020,Mumbai,Healthcare,"I am Love came into existence in early 2020, with the aim of redefining the relationship we have with our health.",Shilpa Rathi,Xentel Investments,4000000,Seed
584,July,MyGlamm,2015,Mumbai,D2C,MyGlamm is India’s fastest growing direct-to-consumer beauty brand.,"Darpan Sanghvi, Priyanka Gill",Accel Partners,40000000,
585,July,Gumlet,2019,Bangalore,IT,Gumlet has built a new-age media delivery infrastructure that provides low code or no-code integration plugins that automate the entire media publishing pipeline.,"Divyesh Patel, Aditya Patadia",Sequoia’s Surge,1600000,
586,July,Eloelo,2015,Bangalore,Gaming,Creator-led Social Gaming & Live Streaming Platform,"Saurabh Pandey, Akshay Dubey","Waterbridge, Lumikai",2000000,Pre-series A
587,July,Edukemy,2020,Noida,EdTech,"Edukemy is the first EdTech company in the country, in the non –STEM segment, offering an immersive learning experience to the students, supported by cutting-edge technology and an AI-based evaluation system.",Chandrahas Panigrahi,"Auxano, Falcon5",2000000,Pre-series A
588,July,Zingbus,2019,Gurugram,Mobility,Zingbus is a renowned brand in the bus operating industry.,"Mratunjay, Prashant Kumar, Ravi Kumar Verma",Infoedge ventures,5000000,Pre-series A
589,July,NewsReach,2018,Ahmedabad,Media,NewsReach is a Mumbai based company that wants to create a disruptive ecosystem of original and local news content.,"Soniya Kundnani, Darshan Shah",JITO Angel Network,300000,Seed
590,July,Pencilton,2017,Hyderabad,FinTech,"India's first app for kids & teens to manage and spend pocket money while learning about money in a fun, gamified way.","VishwajitPureti, Ashish Singh, Pallavi Tipparaju, Viraj Gadde",Jupiter,330000,Pre-seed
591,July,Bandhoo,2020,Gurugram,IT,"Bringing ease of eCommerce to Construction for builders, infrastructure companies, contractors and workers","Prashant Gupta, Sridhar Sundaram",Unitus Ventures,1000000,
592,July,ixigo,2007,Gurugram,IT,"AI-based travel app offering seamless planning and booking for flights, trains, buses, hotels and more!","Rajnish Kumar, Aloke Bajpai","GIC, Infoedge",53000000,
593,July,The Whole Truth,2019,Mumbai,Food & Beverages,"Believe simple, homely ingredients, minimally processed, are the secret to nutritious, tasty food",Shashank Mehta,Sequoia Capital,6000000,Series A
594,July,Insane AI,2021,Bangalore,Fitness,Mainstream fitness formats are a primitive solution to the modern problems of a sedentary lifestyle.,"Anurag Mundhada, Jayesh Hannurkar, Sourabh Agrawal",pi Ventures,800000,Seed
596,July,Droom,2014,Gurugram,Automobile,"Droom is an AI and data science driven online transactional platform, which offers 21st century experience in buying & selling used & new automobiles in India",Sandeep Aggarwal,,200000000,
597,July,Skymet,2003,Noida,Environmental Services,Provide services that allow clients to understand and organize themselves around changing environment.,Yogesh Patil,"Northern Arc, Caspian Impact Investments",1000000,
598,July,Go Swift,2019,Bangalore,Consumer Services,Help small & medium sized businesses to grow by helping them with their shipping requirements at the cheapest and most reliable service.,"Shyam Kalita, Debanshu Sinha, Prayas Mittal",Kalaari Capital,2000000,Pre-series A
599,July,Mamaearth,2016,Gurugram,Healthcare,A brand which develops products from world-class research and attempts to solve every little problem that we as parents face.,"Varun Alagh, Ghazal Alagh",Sofina Ventures SA,50000000,
600,July,G.O.A.T,2021,Bangalore,D2C,G.O.A.T Brand Labs provides a tech-enabled platform for D2C brands to scale.,"Rishi Vasudev, Rameswar Misra","Tiger Global, Flipkart Ventures",36000000,Series A
602,July,ReDesyn,2016,Mumbai,Merchandise,"Merchandise drop-shipping platform for influencers, designers, creators & brands.","Smriti Dubey, Shikhar Vaidya",Anthill Ventures,300000,Pre-series A
603,July,Inspacco,2019,Pune,Facilities Services,"For residential commercial and industrial establishments , Inspacco is a one stop solution , that delivers affordable improvement and maintenance services","Sanket Nerkar, Paresh Kotkar",,200000,
604,July,Knorish,2016,Gurugram,EdTech,"Saas platform offers a feature packed platform enables businesses, experts, professionals, artists, instructors, specialists, coaches, people seeking work from home opportunities","Rakhi Wadhwa, Kinner N Sacchdev","Inflection Point Ventures, Rockstud Capital, Pentathlon Ventures, Prophetic Ventures syndicate",1000000,Pre-series A
605,July,Dozee,2015,Bangalore,Healthcare,"Dozee is India's only contactless health monitor that silently tracks your heart, respiration, sleep patterns, stress levels, cardiac contractions, apnea and more while you sleep.","Mudit Dandwate, Dandwate",Prime VP,5000000,Series A
606,July,BlackBuck,2015,Bangalore,Logistics & Supply Chain,BlackBuck marks the beginning of a new path in trucking. A path that is organized and makes trucking simple for every shipper and trucker.,"B Ramasubramanian, Chanakya Hridaya, Rajesh Yabaji","Tribe Capital, IFC Emerging Asia Fund, VEF",67000000,Series E
607,July,Mailmodo,2020,Bangalore,Marketing & Advertising,Mailmodo is a complete email marketing solution enabling users to create and send app-like interactive emails to improve email conversions.,"Aquibur Rahman, Apurv Gupta, Devyesh Tandon","Sequoia’s Surge, Y Combinator",2000000,Seed
609,July,NirogStreet,2018,New Delhi,Healthcare,Nirogstreet as a concept is working to make #Ayurveda first call of treatment.,Ram N Kumar,"Gokul Rajaram, Pureland Venture, Wavemaker Partners",2500000,Series A
612,July,Even,2020,Bangalore,Healthcare,One monthly subscription to cover all your healthcare needs.,"Mayank Banerjee, Matilde Giglio, Alessandro Davide Ialongo",Khosla Ventures,5000000,Seed
613,July,Captain Fresh,2019,Bangalore,Logistics,A B2B marketplace leveraging technology to deliver the fastest harvest-to-retail in the industry.,Utham Gowda,"Accel Partners, Matrix India",12000000,Series A
614,July,Otipy,2020,Gurugram,Food & Beverages,Otipy helps the farmer to deliver farm fresh vegetables & fruits at doorstep.,Varun Khurana,"Omidyar Network India, Innoven Capital",10200000,Series A
615,July,Lenskart,2008,Faridabad,Eyewear,India's fastest growing eyewear company and largest eyewear company online.,Peyush Bansal,"Temasek, Falcon Edge",220000000,
616,July,Eka.care,2020,Bangalore,Healthcare,A digitally enabled and connected healthcare ecosystem for better health outcomes.,Vikalp Sahni,"Deep Kalra, Ashish Kashyap, Rajesh Magow",4500000,
617,July,Braingroom,2015,Chennai,EdTech,"BrainGroom is an online marketplace for educational, recreational & wellness classes with defined target segment, quantifiable outcomes & specified time duration.","Madhula Sathyamoorthy, Naliene Ramasamy, Kalaiarsi Periasamy","IAN, Social Alpha, Startup Oasis",200000,
