,Month,Company/Brand,Founded,Headquarters,Sector,What it does,Founder/s,Investor/s,Amount,Stage
244,October,Totality,2017,Gurugram,Entertainment,"Totality with the goal of combining scalability through technology, innovation through design & retention through content.",Anshul Rustaggi,"Leo Capital, Mayfield Fund",1000000,
245,October,CredAble,2017,Mumbai,Financial Services,CredAble provides liquidity programs for enterprise supply chains.,Nirav Choksi,"Plutus Wealth, Oaks Asset Management",30000000,Series B
246,October,MarketWolf,2017,Mumbai,Financial Services,"MarketWolf provides everyone an opportunity to begin their trading journey with a unique digital platform that is bold, simple and fun.","Vishesh Dhingra, Thomas Joseph","Anil Thadani, Ashutosh Sinha, Roy van Leeuwen",5500000,Seed
247,October,Wondrlab,2020,Mumbai,Marketing & Advertising,India's largest platform-first martech startup,Saurabh Varma,"Pi Ventures LLP, Tanas Capital, Prodapt Holdings",7000000,Pre-series A
248,October,SUN Mobility,2017,Bangalore,Automotive,Provider of universal energy infrastructure and services to accelerate mass EV usage!,Chetan Maini,Vitol,50000000,
249,October,Tamasha,2020,Mumbai,Entertainment,"Tamasha, the next-generation interactive entertainment platform.","Saurabh Gupta, Siddharth Swarnkar",Chiratae Ventures,3000000,Pre-series A
250,October,Revfin,2017,New Delhi,Financial Services,"RevFin is a financial technology (FinTech) company, advanced digital lending platform makes getting a loan convenient and accessible for customers",Sameer Aggarwal,"Ruchirans Jaipuria, Rishi Kajaria",4000000,Pre-series A
251,October,Yu Foodlabs,2020,Gurugram,Food & Beverages,Re-imagining Packaged Foods with Natural Ingredients & ZERO Preservatives,"Bharat Bhalla, Varun Kapur","Manish Choksi, Varun Vakil",1000000,Pre-series A
252,October,MergerDomo,2018,New Delhi,Investment Banking,MergerDomo is the one-stop Global OnLine M&A marketplace for Corporate and Business Growth,Hormazd Charna,Nadir B Godrej,500000,
253,October,FarMart,2015,Gurugram,Farming,FarMart is an agritech platform that helps businesses easily source high quality produce at reasonable prices.,"Alekh Sanghera, Mehtab Singh Hans",Matrix Partners India,10000000,Series A
254,October,Questt,2020,Gurugram,EdTech,Questt is a Free online homework app that lets teachers assign gamified homework to students.,"Akhil, Mohsin M, Rohit Pande",Celesta Capital,6750000,Series A
255,October,IDfy,2011,Mumbai,Information Technology & Services,IDfy helps people and business build authentic relationships by ensuring that both parties are who they claim to be and can be trusted.,Ashok Hariharan,"TransUnion, Blume Ventures",10000000,Series D
256,October,ClearDekho,2016,Ghaziabad,Retail,ClearDekho is India’s Leading Affordable Eyewear Brand.,"Saurabh Dayal, Shivi Singh",Aroa Ventures,4000000,Pre-series A
257,October,BookingJini,2017,Gurugram,Hospitality,BookingJini strive to empower Hotels from all aspects ranging from customer outreach to automate their booking process and improve their online presence and revenue to stimulate Top-line and Bottom-line growth.,"Deepak Dash, Gourab Kumar Nandy, Manoj Pandia, Sibasish Mishra",Mumbai Angels Network,1200000,Pre-series A
258,October,Sourcewiz,2021,Gurugram,Information Technology & Services,Building a platform for exporters to digitize their workflows and help them grow and manage their business.,"Divyaanshu Makkar, Vikas, Mayur","Blume, Alpha Wave Incubation",3000000,Seed
259,October,Tvasta,2016,Chennai,Mechanical Or Industrial Engineering,Developing new-age manufacturing and automation technologies that can increase human productivity by allowing deep personalization.,"Vidyashankar C, Parivarthan Reddy, Adithya Jain",Habitat for Humanity International,400000,
260,October,Kafqa Academy,2021,Bangalore,E-learning,"Kafqa Academy is a global performing arts academy that offers classes in dancing, singing, and speech & drama.",Shariq Plasticwala,"Global Founders Capital, Enzia Ventures, Better Capital",1300000,Seed
261,October,Trell,2016,Bangalore,Social commerce,Trell is turning over a new leaf with the wave of digitalization sweeping across the nation,"Pulkit Agrawal, Arun Lodhi, Bimal Kartheek Rebba",Amazon,100000000,
262,October,Storia,2016,Mumbai,Food & Beverages,"Storia Foods and Beverages is committed to creating products that are natural, full of goodness and promote a healthy lifestyle.",Vishal Shah,Sixth Sense Ventures,6000000,Series A
263,October,Clear,2011,Bangalore,Computer Software,India’s leading FinTech SaaS platform,"Archit Gupta, Srivatsan Chari","Kora Capital, Stripe, Alua Capital",75000000,Series C
264,October,Groww,2016,Bangalore,Finance,Groww is on a mission to democratize access to financial services for millions of Indians responsibly.,"Lalit Keshre, Harsh Jain, Ishan Bansal, Neeraj Singh",Iconiq Growth,250000000,Series E
265,October,The Indus Valley,2016,Chennai,Consumer Goods,Consumer GoodsThe Indus Valley is a Direct to Consumer (D2C) healthy kitchenware brand.,"Jagadeesh Kumar, Madhumitha Udaykumar","Rukam Capital, DSG Consumer Partners, The Chennai Angels",1100000,
266,October,BharatPe,2018,New Delhi,Financial Services,"BharatPe launched India’s first UPI interoperable QR code, first ZERO MDR payment acceptance service, and first UPI payment backed merchant cash advance service.","Ashneer Grover, Shashvat Nakrani",MAS Financial Services,10000000,
267,October,Teachmint,2020,Bangalore,E-learning,Teachmint is an education infrastructure provider and India’s largest teaching platform.,"Divyansh Bordia, Mihir Gupta","Rocketship.vc, Vulcan Capital",78000000,Series B
268,October,Porter,2014,Bangalore,Logistics & Supply Chain,Porter is India's Largest Marketplace for Intra-City Logistics.,"Pranav Goel, Uttam Digga, Vikas Choudhary","Tiger Global, Vitruvian Partners",100000000,Series E
269,October,O4S,2017,Gurugram,Information Technology & Services,O4S SaaS helps Consumer Brands to Digitize and Automate their Supply Chain thereby increasing Sales and Performance.,"Divay Kumar, Shreyans Sipani","Think Investments, Venture Highway",6000000,Series A
270,October,Wobb,2020,Gurugram,Marketing,The platform for marketers to find and work with influencers,Ishan Jindal,"Alok Kohli, Sanjeev Bhargava",200000,Pre-seed
271,October,BASIC Home Loan,2020,Gurugram,Financial Services,BASIC Home Loan is India's first automated platform for secured lending with special focus on the affordable housing segment.,"Atul Monga, Kalyan Josyula","Venture Catalysts, Gruhas Proptech",3500000,Series A
272,October,Siply,2020,Bangalore,Financial Services,"A tech-enabled micro-savings platform, for the underserved masses, that makes it possible to save starting at Re. 1","Sousthav Chakrabarty, Anil Bhat","LetsVenture, AngelList India, Founder's Room Circle",3200000,Pre-series A
273,October,BankSathi,2020,New Delhi,Financial Services,"BankSathi is a Fintech platform to empower consumers to save money and time on financial products through safe, easy, and trustable shopping experience.",Jitendra Dhaka,"Dinesh Godara, Anuj Ahuja, Aditya",500000,
274,October,Gramophone,2016,Indore,AgriTech,"Create a difference in farming by bringing timely information, technology and right kind of inputs to achieve better yields for farmers.","Tauseef Khan, Harshit Gupta",Z3Partners,10000000,
275,October,Healofy,2016,Bangalore,Femtech,Healofy was created with a mission to experience special motherhood through its products and its inexhaustive and evergrowing babycare tips,"Gaurav Aggarwal, Shubham Maheshwari","Celesta Capital, Omidyar Network India",6000000,Series B
276,October,E42,2012,Pune,Computer Software,E42 is the world’s leading Natural Language Processing- based AI platform driving enterprise cognition across processes.,"Animesh Samuel, Sanjeev Menon",Pavestone Ventures,5400000,Series A
277,October,Spottabl,2017,Bangalore,Human Resources,Spottabl is a technology driven recruitment platform that has helped over 50 tech startups and growth stage companies discover their top talent through its intelligent and human backed model.,"Vanishri Deshpande, Satheesh K V, Anupam Choudhari","LetsVenture, Paradigm Shift VC, Binny Bansal",400000,Seed
278,October,DeHaat,2012,Gurugram,Information Technology & Services,DeHaat™ is one of the fastest growing start-ups in Agri Tech sector and one of the very few companies providing end-to-end solutions and services to the farming community in India.,"Amrendra Singh, Shyam Sundar, Adarsh Srivastav, Shashank Kumar","Sofina, Lightrock India, Temasek",115000000,Series D
280,October,Zolve,2020,Bangalore,Financial Services,World's first cross-border Neobank,Raghunandan G,DST Global,40000000,Series A
281,October,Instoried,2018,Bangalore,Computer Software,"The platform helps content writers in e-commerce, news, FMCG, and other verticals to optimize emotions in their marketing content.",Sharmin Ali,"Pritt Investment Partners, 9Unicorns",8000000,
282,October,SportZchain,2021,Mumbai,sports,SportZchain is India's first blockchain based platform poised to disrupt a multi-billion dollar fan engagement industry.,Siddharth Jaiswal,"Darq Capital, Jagadeesh Atukuri",400000,Pre-seed
283,October,Hypto,2018,Chennai,Tech startup,The next generation of web services that democratize access to finance for developers and businesses.,"Abhishek Rajagopal, Aravind Sriraman, Tholkappiyan Velavan",Stellaris Venture Partners,3000000,Seed
284,October,CHUPPS,2016,Mumbai,Foootwear,D2C footwear brand,"Gaurav Agarwal, Yash Mukhi",Venture Catalysts,1100000,Pre-series A
285,October,Zenduty,2019,Bangalore,Computer Software,"Next-generation end-to-end incident response platform for SREs, DevOps, ITOps and Support teams","Ankur Rawal, Vishwa Krishnakumar",StartupXseed Ventures,1900000,Pre-series A
286,October,R for Rabbit,2014,Ahmedabad,Consumer Goods,The concept of R for Rabbit was conceived after the founder of the company was blessed with a baby.,Kunal Popat,Xponentia Capital Partners,5000000,
287,October,Acko,2016,Bangalore,Insurance,ACKO is India’s first and fastest growing InsurTech company which makes buying and using insurance effortless.,"Varun Dua, Ruchi Deepak","General Atlantic, Multiples",255000000,Series D
288,October,LoveLocal,2015,Mumbai,Retail,LoveLocal (formerly known as m.Paani) is bringing Trusted Local Shops Online and empowering them to deliver the neighbourhood shopping experience of the future.,Akanksha Hazari,Vulcan Capital,18000000,Pre-series B
289,October,SupplyNote,2015,Noida,Food & Beverages,"SupplyNote is Cloud based web and mobile enabled suite connecting outlets, service providers and suppliers.","Kushang, Abhishek Verma, Nitin Prakash, Harshit Mittal",Venture Catalysts,1200000,Pre-series A
290,October,Vakilsearch,2010,Chennai,Legal Services,"India's largest Legal, Compliance & Tax services platform, and trusted partner in making legal simple!",Hrishikesh Datar,InCorp India,10000000,
291,October,Cloudphysician,2017,Bangalore,Hospital & Health Care,Cloudphysician is a healthtech company that is transforming the delivery of critical care.,"Dr Dhruv Joshi, Dr Dileep Raman",Elevar Equity,4000000,Pre-series A
292,October,Wiggles.in,2018,Pune,Veterinary,Wiggles India is a preventative healthcare brand for all things pets!,Anushka Iyer,Anthill Ventures,5500000,Pre-series A
293,October,Avanti Finance,2017,Bangalore,Financial Services,A digital platform to make financial services accessible to 100 million unserved and underserved households across India,"Nandan Nilekani, Vijay Kelkar","Oikocredit, Nomura, The Bill & Melinda Gates Foundation",15000000,Series A2
294,October,Vanity Wagon,2018,New Delhi,Consumer Goods,Vanity Wagon is India's first true information oriented clean beauty marketplace.,"Prateek, Naina Ruhail, Sahil Shreshtha",Inflection Point Ventures,700000,Pre-series A
295,October,Purplle,2012,Mumbai,E-commerce,Purplle.com is one of India’s largest e-beauty destinations with more than 7 million monthly active users.,"Rahul Dash, Manish Taneja",Kedaara,70000000,
297,September,MFine,2017,Bangalore,Hospital & Health Care,"MFine aims to make access to trusted healthcare simple, fast, and effective.","Prasad Kompalli, Ashutosh Lawania","Moore Strategic Ventures, BEENEXT",48000000,Series C
299,September,Mentza,2020,Mumbai,E-learning,"Make great conversations accessible to everyone through a vibrant, small, safe, and easy real-time audio platform","Anurag Vaish, Tapasi Mittal, Fareesh Vijayarangam, Anand Parameswaran, Divya Balakrishnan",Inflection Point Ventures,400000,Seed
300,September,ConnectedH,2018,Gurugram,Hospital & Health Care,Connect different sectors of healthcare system and give the patients complete control over their information.,"Shubham Gupta, Rahul Kumar, Suresh Singh","Kalaari Capital, Incubate Fund India",2300000,Seed
301,September,CredAvenue,2017,Chennai,FinTech,CredAvenue is an organization on a mission to deepen and power the 120Trillion global enterprise debt market which would unlock a GDP multiplier and thus create massive economic value.,Gaurav Kumar,"Sequoia Capital, Lightspeed, TVS Capital Funds",90000000,Series A
302,September,Vedantu,2011,Bangalore,E-learning,Vedantu is a LIVE online learning platform that brings together students and teachers to achieve best results.,"Vamsi Krishna, Pulkit Jain, Saurabh Saxena, Anand Prakash",ABC World Asia,100000000,Series E
303,September,Exotel,2011,Bangalore,Telecommunications,"Asia's largest customer engagement platform, streamlining customer interactions for Swiggy, Ola, Flipkart, GoJek etc.","Shivakumar Ganesan, Ishwar Sridharan, Siddharth Ramesh, Vijay Sharma","IIFL AMC, Sistema Asia Fund, CX Partners, Singularity Growth Opportunities Fund",35000000,Series C
304,September,Fantasy Akhada,2020,Gurugram,sports,Fantasy Akhada is one of India's fastest growing Fantasy Sports Platform.,"Amit Purohit, Sumit Kumar Jha",Prime Securities Limited,2000000,Series A
305,September,Meesho,2015,Bangalore,Social commerce,Meesho is India’s largest marketplace for longtail products.,"Sanjeev Barnwal, Vidit Aatrey","Fidelity, B Capital",570000000,
307,September,Cusmat,2016,Hyderabad,Computer Software,CUSMAT is India’s largest immersive skilling and training platform.,"Abhinav Ayan, Anirban Jyoti Chakravorty",We Founder Circle,100000,Pre-series A
308,September,Homeville,2017,Mumbai,Information Technology & Services,A technology company focused on helping people buy their first home with down payment assistance at zero interest cost.,Madhusudan Sharma,"9Unicorns, Varanium NexGen Fund",7000000,
309,September,Coinshift,2021,Chandigarh,Blockchain,CoinShift helps businesses and decentralised autonomous organisations (DAO's) manage their crypto easily,Tarun Gupta,"Sequoia Capital, Sandeep Nailwal",2500000,Seed
310,September,Strip Finance,2021,Hyderabad,Financial Services,Collateralised NFT & DeFi Liquidity Protocol With Interest Rate Discovery.,"Varun Satyam, Yuvraj Chhibber, Yash Jejani","Old Fashion Research, Nothing Research, Tenzor capital",400000,Seed
311,September,Ola Electric,2017,Bangalore,Automotive,Charging ahead to accelerate the world’s transition to sustainable mobility.,Bhavish Aggarwal,"Falcon Edge, Softbank",200000000,
312,September,Kolo,2020,Bangalore,Construction,Home construction app for finding ideas and service providers near you,"Pranav Garg, Jery Althaf",Better Capital,550000,Pre-seed
313,September,Chqbook,2017,Gurugram,FinTech,"Chqbook.com is India’s first neobank for small business owners offering world-class financial services through its five pillars of banking, khata, lending, insurance, and rewards.","Vipul Sharma, Rajat Kumar, Sachin Arora","Aavishkaar Capital, Rajiv Dadlani Group",5000000,Pre-series B
315,September,EV Plugs,2021,Gurugram,Information Technology & Services,EV charging station aggregator platform,"Manish Narang, Kapil Narang, Ashwani Arora",,150000,
316,September,Rulezero,2019,Bangalore,Financial Services,"Rulezero is a legal/fintech startup reimagining private markets by building an intelligent platform that enables stakeholder participation and capital flow in a transparent, efficient and compliant manner.","Satish Mugulavalli, Srinivas Katta",The Treasury,2500000,Seed
317,September,CredRight,2016,Hyderabad,Financial Services,"CredRight is a new age digital lending company 100% focused on Micro & Small businesses, making the process of availing loans simple",Neeraj Bansal,"9Unicorns, Spearhead Capital, Venture Catalysts",2700000,
318,September,Karbon Card,2019,Bangalore,FinTech,"Empower Indian startups by creating the right financial products starting with a high-limit corporate credit card with unlimited benefits, no personal liability and no fixed deposit.","Pei-fu Hsieh, Amit Jangir, Kartik Jain, Sunil Sinha","Ramp, Rainfall Ventures, Roka Works, Y Combinator",12000000,Pre-series A
319,September,Auntie Fung,2015,Bangalore,Food & Beverages,Serving delectable and eclectic pan-Asian fare to all foodies in a quick-service & healthy format,"Satrajit Das, Subhradeep Bhowmik",India Angel Network,400000,
320,September,ePayLater,2015,Mumbai,Financial Services,ePaylater is a payment solution that aims to separate the experience of shopping from the hassles of payment process.,"Aurko Bhattacharya, Akshat Saxena","Responsibility, Blue Ashva Capital, Pravega Ventures",10000000,Series B
321,September,Fittr,2016,Pune,"Health, Wellness & Fitness","FITTR’s mission is to reach out to 50 million people and make them fit, create jobs in the fitness industry, teach people how easy it is to stay fit and move together as a Wolfpack.","Rohit Chattopadhyay, Jitendra Chouksey, Suniel Shetty, Sonal Singh, Bala Dabbedi","Dream Capital, Elysian Park Ventures",11000000,Series A
322,September,Medikabazaar,2014,Mumbai,Healthtech,"Medikabazaar, India’s pioneering and largest online B2B marketspace for medical supplies and equipment.","Vivek Tiwari, Ketan Malkan","CDC Group, Creaegis",75000000,Series C
324,September,Delhivery,2011,Gurugram,Logistics & Supply Chain,Delhivery is a leading logistics and supply chain services company in India.,Sahil Barua,"Lee Fixel’s venture capital firm, Addition",125000000,
325,September,Akudo,2020,Bangalore,Financial Services,A Learning-First Neobank for teenagers - Enable practical financial education for child today,"Lavika Aggarwal, Sajal Khanna, Jgaveer Gandhi","Y Combinator, JAFCO Asia, Incubate Fund India, marquee angels",4200000,Seed
326,September,Sanctum Wealth,2016,Mumbai,Investment Management,Sanctum is an Indian wealth management firm which has acquired RBS India’s Private Banking business.,Shiv Gupta,The Xander Group,10000000,
327,September,88academics,2018,New Delhi,Education,88academics an 88tuition Pte Ltd has been established with the social objective of making quality video-based learning material available to all students.,Anil Ahuja,Aarin Capital,3000000,Pre-series A
329,September,Sanfe,2018,New Delhi,"Health, Wellness & Fitness",India’s revolutionary feminine hygiene and period care brand that strives to build a better world for women.,"Archit Aggarwal, Harry Sehrawat","LetsVenture, Ajay Garg, Tarun Sharma",1000000,Series A
330,September,PredictiVu,2020,Gurugram,Management Consulting,"PredictiVu's AI-enabled dashboard integrated with India's largest, proprietary, weekly consumer purchase data, market intelligence and web insights",,Kunal Sarkar,1500000,Pre-seed
331,September,Sterling Accuris Wellness,2016,Ahmedabad,Hospital & Health Care,"STERLING ACCURIS WELLNESS PRIVATE LIMITED is a hospital & health care company based out of 3-FLOOR HERITAGE COMPLEX, NR.",Girish Patel,Morgan Stanley Private Equity Asia,30000000,
332,September,Bijnis,2015,New Delhi,B2B startup,Bijnis is revolutionizing the way manufacturers operate and scale their factories by digitizing their Demand/Supply/Captial/Operations.,"Siddharth, Chaitanya Rathi, Siddharth Rastogi, Shubham Agarwal",Westbridge Capital,30000000,Series B
333,September,Capital Float,2013,Bangalore,Financial Services,India's leading BNPL and digital credit platform serving millions of aspirational individuals.,"Sashank Rishyasringa, Gaurav Hinduja",Lightrock India,50000000,
334,September,Manch Technologies,2017,Bangalore,Information Technology & Services,"A Single Click Work Flow E-Sign solution to conduct speedy, accurate, efficient transactions through a “cash-less, presence-less, paperless” framework.",Suresh Anantpurkar,Bharat Inclusion,1000000,Pre-series A
336,September,Glamyo Health,2019,New Delhi,Hospital & Health Care,Glamyo Health is an advanced healthcare co delivering a seamless experience for elective surgeries.,"Archit Garg, Dr Preet Pal Thakur",Ananta Capital,3000000,Series A
337,September,CashBook,2020,Gurugram,FinTech,"CashBook is a digital record-keeping app using which businesses can add entries, segregate records, and find overall balance instantly.","Vivek, Ashutosh Pathak","JAM, Better Tomorrow Ventures",2300000,Seed
338,September,The Money Club,2016,Noida,Financial Services,The Money Club is a mobile platform for peer to peer chit funds.,"Manuraj Jain, Surajit Ra","SOSV, Venture Catalysts",1700000,Pre-series A
339,September,SuperZop,2016,Mumbai,Retail,SuperZop is India's first and only vernacular B2B Grocery e-commerce platform that is transforming the unorganized retail sector.,"Raghuveer Allada, Prithwi Singh, Darshan Krishnamurthy",Incofin’s India Progress Fund,4000000,Series A
340,September,Zypp Electric,2017,Gurugram,Logistics & Supply Chain,"Zypp is working to convert all deliveries for e-commerce, grocery, medicine and food vertical to go electric with e-scooter sharing app.","Akash Gupta, Rashi Agarwal","9Unicorns, Anthill Ventures",7000000,Series A
341,September,Alpha Coach,2021,Mumbai,Professional Training & Coaching,One to One Personal Fitness Coaching,Ketan Mavinkurve,Jani Ventures INC,1200000,
342,September,VRO Hospitality,2018,Bangalore,Hospitality,One of the fastest-growing hospitality companies based out of Bangalore.,"Safdhar Adoor, Sharath Rice, Dawn Thomas",CreedCap Asia Advisors,3000000,Series A
343,September,byteXL,2019,Hyderabad,E-learning,"ByteXL is the first-ever, one-stop-shop for self-learning course work and guided training – preparing a new generation of coders for the workforce.","Sricharan Tadepalli, Karun Tadepalli",Joseph Joy,200000,
344,September,Leena AI,2015,Gurugram,Computer Software,AI to help enterprises transform the employee experience.,"Mayank Goyal, Anand Prajapati",Bessemer Venture Partners,30000000,Series B
345,September,CARS24,2015,Gurugram,Automotive,"CARS24 is proud to be a tech-first organisation, looking to make inroads into the global auto-tech market in groundbreaking ways.","Mehul Agrawal, Vikram Chopra","DST Global, Falcon Edge, SoftBank Vision Fund 2",450000000,Series F
346,September,Klub,2019,Bangalore,Financial Services,"A team of fintech, investment banking, venture capital, and technology veterans who bring a founder-first mindset.","Anurakt Jain, Ishita Verma",Trifecta Capital,2000000,Debt
347,September,Bluepad,2020,Bangalore,Online Media,A one-stop solution for aggregated content in vernacular languages,"Sanjyot Bhosale, Devakrishna Asokar, Kishore Garimella","Titan Capital, AngelList's syndicate",200000,Pre-seed
348,September,FloBiz,2019,Bangalore,Information Technology & Services,Neobank for Growing SMBs. Simplify GST Billing & Accounting needs with myBillBook App.,"Rahul Raj, Aditya Naik, Rakesh Yadav",Sequoia Capital India,31000000,Series B
349,September,Tummoc,2016,Bangalore,Mobility,Tummoc helps track and find actionable & accurate bus/metro/suburban rail intracity travel information.,"Hiranmay Mallick, Monalisha Thakur, Narayan Mishra","Vineet Singh, Krishna D, Deependra Bisht, Alan Aim",540000,Seed
350,September,Design Cafe,2015,Bangalore,Design,Design Cafe is on a mission to democratize good design for homes in India.,"Shezan Bhojani, Gita Ramanan","Westbridge Capital, Sixth Sense Ventures",25000000,
352,September,Aerchain,2019,Bangalore,Computer Software,Advance Source-to-Pay cycle to a new level with Artificial Intelligence!,"Harsha Kadimisetty, Himavanth Jasti","Season Two Ventures, IndiaMart",3000000,Pre-series A
354,September,CuriousJr,2020,Gurugram,E-learning,CuriousJr is a platform to answer kids' curiosity and prepare them for 21st-century skills.,"Amit Shekhar, Janishar Ali, Mridul Ranjan Sahu","WaterBridge Ventures, Enzia Ventures",1000000,Seed
355,September,Wow! Momo,2008,Kolkata,Food & Beverages,WOW! Momo is one of the fastest-growing food brands in India.,"Binod Homagai, Sagar Daryani, Shah Miftaur Rahman",Tree Line Investment Management,15000000,Series C
356,September,Supertails,2021,Bangalore,Consumer Services,Supertails is building a digital pet care platform which offers expert led healthcare services and products.,"Vineet Khanna, Varun Sadana, Aman Tekriwal",Alteria Capital,700000,
357,September,LifeCell,2004,Chennai,Biotechnology,A building block of the team that preserves the building blocks of life,S. Abhaya Kumar,Orbimed Asia Partners,30000000,
358,September,ZestMoney,2015,Bangalore,Financial Services,"ZestMoney helps make it accessible for millions to upgrade, to enhance, to rise, while keeping it affordable.","Priya Sharma, Lizzie Chapman",Zip Co,50000000,Series C
359,September,FrontRow,2020,Bangalore,E-learning,"FrontRow enables everyone to pursue their passions - get better, learn from the best and get noticed!","Shubhadit Sharma, Mikhil Raj, Ishaan Preet Singh","Eight Roads Ventures, GSV",14000000,Series A
360,September,HappyCredit,2020,Bangalore,FinTech,"HappyCredit is on a mission to make online shopping delightful for 400mn bharat shoppers with credit, rewards, shopping inspiration and more.","Jitendra Kumar, Ashish Virmani","Kunal Shah, Krishna Kumar",600000,Pre-seed
